"","state","acfrs_original_name","acfrsID","ncesID"
"1692","ND","Mt. Pleasant Public School District No. 4","326286",NA
"1693","MT","Big Sky Special Needs Cooperative","46803",NA
"1694","MT","Malta Public School District 14a","326274",NA
"1695","NH","Barrington New Hampshire School District","326298",NA
"1696","MO","Monroe City R-I School District","326267",NA
"1697","NJ","Kenilworth School District","326306",NA
"1698","NM","Capitan Municipal Schools","326326",NA
"1699","IL","Burr Ridge Community Consolidated School District 180","51824",NA
"1700","CO","Morgan County School District Re-3","1143212",NA
"1701","MO","Osage County R-III School District","338790",NA
"1702","VT","Windsor Southeast Supervisory Union","39390",NA
"1703","TN","Anderson County Schools","339835",NA
"1704","IL","United Township High School District #30","224671",NA
"1705","GA","Central Savannah River Area Regional Commission","224014",NA
"1706","CO","Aguilar School District Re-6","398330",NA
"1707","CO","Estes Park School District R-3","1142927",NA
"1708","AZ","Ajo Unified School District No. 15","98817",NA
"1709","AZ","Duncan Unified School District No. 2","398381",NA
"1710","CA","Rio Bravo-Greeley Union Elementary School District","146557",NA
"1711","AR","Northwest Arkansas Education Service Cooperative","43818",NA
"1712","AR","Ozarks Unlimited Resources Educational Cooperative","101685",NA
"1713","AR","Dequeen-Mena Educational Service Cooperative","30778",NA
"1714","AZ","Littlefield Unified School District No. 9","398397",NA
"1715","IL","LaSalle-Peru Township High School No. 120","1027408",NA
"1716","IL","Lake Bluff Schools District No. 65","398451",NA
"1717","IL","Maroa-Forsyth Community Unit School District No. 2","398453",NA
"1718","IL","Metamora Township High School District No. 122","398454",NA
"1719","CA","Fresno County Superintendent of Schools","67306",NA
"1720","IL","Rock Falls Township High School District No. 301","398466",NA
"1721","IL","St. Clair County Regional Office of Education No. 50","41271",NA
"1722","IL","The City of Lake Forest School District 67","398467",NA
"1723","IL","Westchester Public School District 92","167556",NA
"1724","IN","Nettle Creek School Corporation","109878",NA
"1725","IN","Pike County School Corporation","109890",NA
"1726","IN","South Spencer County School Corporation","109919",NA
"1727","IN","South Newton School Corporation","109888",NA
"1728","KS","Unified School District No. 258","398488",NA
"1729","KS","Unified School District No. 366","398489",NA
"1730","MA","Groton-Dunstable Regional School District","46903",NA
"1731","KS","Unified School District No. 484","398490",NA
"1732","MA","Lincoln-Sudbury Regional School District","398504",NA
"1733","MA","Masconomet Regional School District","167065",NA
"1734","MA","Essex North Shore Agricultural and Technical School District","57449",NA
"1735","IN","Southeast Dubois County School Corporation","109909",NA
"1736","IN","South Gibson School Corporation","109921",NA
"1737","IN","Lewis Cass Schools","64838",NA
"1738","ME","Indian Township Passamaquoddy School Committee","93954",NA
"1739","KS","Interlocal No. 608 Northeast Kansas Education Service Center","74721",NA
"1740","IN","Southeast Fountain School Corporation","109902",NA
"1741","CO","Weld County School District Re-1","1151521",NA
"1742","KS","Sedgwick County Area Educational Services Interlocal Cooperative","33554",NA
"1743","IL","Princeville Community Unit School District No. 326","398537",NA
"1744","IL","Will County Regional Office of Education No. 56","74472",NA
"1745","CA","Westside Elementary School District","146775",NA
"1746","MO","Cole County R-V School District","398546",NA
"1747","IL","Williamsville Community Unit School District 15","398554",NA
"1748","IL","Creve Coeur School District No. 76","398553",NA
"1749","MO","New Bloomfield School District","398561",NA
"1750","MS","Hancock County School District","81558",NA
"1751","MS","New Albany School District","81574",NA
"1752","MT","Ashland School District No. 32j","44508",NA
"1753","MT","Bigfork Public Schools","398570",NA
"1754","MT","Columbia Falls School District","398571",NA
"1755","MT","Darby Public Schools","398572",NA
"1756","MT","Bitterroot Valley Education Cooperative","35419",NA
"1757","MT","Red Lodge School District 1","398574",NA
"1758","MT","Thompson Falls Public Schools","398577",NA
"1759","MT","Somers School District","398575",NA
"1760","MT","Target Range School District 23","398576",NA
"1761","MT","Plentywood School District 20","398573",NA
"1762","MT","West Valley Public Schools","398579",NA
"1763","NJ","Manasquan School District","398618",NA
"1764","NJ","South Orange and Maplewood School District Board of Education","35783",NA
"1765","IL","Community Unit School District No. 140","65415",NA
"1766","NY","Clarkstown Central School Distrcit","398768",NA
"1767","NY","Dutchess County Board of Cooperative Educational Services","197096",NA
"1768","NY","Schalmont Central School District at Rottderdam","36381",NA
"1769","OH","Arlington Local School District","82477",NA
"1770","OH","Athens-Meigs Educational Service Center","45721",NA
"1771","OH","Bethel Local School District","82585",NA
"1772","OH","Bradford Exempted Village School District","82626",NA
"1773","OH","Buckeye Community School","398799",NA
"1774","CT","Pomperaug Regional School District 15","32209",NA
"1775","KS","Unified School District No. 417","398827",NA
"1776","MT","Harlowton School District No. 16","398831",NA
"1777","OH","Hamilton County Educational Service Center","41864",NA
"1778","MO","Ferguson Reorganized School District R-2","42084",NA
"1779","OH","Lincolnview Local School District","83562",NA
"1780","OH","Leipsic Local School District","83516",NA
"1781","OH","Midnimo Cross Cultural Middle School","83769",NA
"1782","OH","Independence Local School District","83392",NA
"1783","OH","Continental Local School District","82909",NA
"1784","OH","Mahoning County Career and Technical Center","37174",NA
"1785","OH","Clark-Shawnee Local School District","37027",NA
"1786","OH","Ohio Digital Learning School","190704",NA
"1787","OH","Marion Local School District","83674",NA
"1788","OH","Columbus Clippers","188320",NA
"1789","OH","Lakeshore Intergenerational School Lis","398859",NA
"1790","OH","Polaris Career Center","37069",NA
"1791","OH","Southern Ohio Educational Service Center","44854",NA
"1792","OH","Miller City-New Cleveland Local School District","83785",NA
"1793","IN","Seymour Community School Corporation","109872",NA
"1794","IN","Edinburgh Community School Corporation","109929",NA
"1795","OH","Ohio Hi-Point Joint Vocational School District","84002",NA
"1796","OK","Wapanucka Public Schools I-37","147716",NA
"1797","FL","Aventura City of Excellence School","68544",NA
"1798","FL","Babcock High School","398990",NA
"1799","FL","Biscayne High School","68624",NA
"1800","FL","Flora Ridge Educational Facilities Benefit District","1063388",NA
"1801","OK","Hanna Public Schools I-64","398902",NA
"1802","OK","Holly Creek Public Schools C-72","147180",NA
"1803","OK","Glover Public Schools C-023","398896",NA
"1804","OK","Sovereign Community School District No. J-4","168683",NA
"1805","OR","Dayton School District No.8","398961",NA
"1806","FL","Byrneville Elementary School","68709",NA
"1807","FL","C.G. Bethel High School","103106",NA
"1808","FL","Chambers High School","68768",NA
"1809","FL","Creative Inspiration Journey of St. Cloud","399040",NA
"1810","FL","Don Soffer Aventura High School","399046",NA
"1811","FL","Dr. Kiran C. Patel High School","399051",NA
"1812","AR","Parkers Chapel School District No. 35","98768",NA
"1813","AZ","St David Unified School District No. 21","399092",NA
"1814","FL","Island Park High School","69387",NA
"1815","FL","Imagine Schools at West Melbourne","224597",NA
"1816","FL","Lone Star High School","69573",NA
"1817","FL","Janie Howard Wilson School","399122",NA
"1818","FL","Lake Wales Senior High School","399128",NA
"1819","FL","Jefferson County Elementary School District","69413",NA
"1820","FL","Mcintosh Area School","69672",NA
"1821","FL","New Beginnings High School","69754",NA
"1822","FL","Micanopy Area Cooperative School","69708",NA
"1823","FL","Nature Coast Middle School","69750",NA
"1824","FL","New Springs Elementary School","399164",NA
"1825","FL","Pensacola Beach Elementary School","69946",NA
"1826","FL","Pinecrest Lakes Middle High","399203",NA
"1827","CA","Kern County Office of Education","30818",NA
"1828","FL","Terrace Community Middle School","70440",NA
"1829","FL","Suncoast School for Innovative Studies","70393",NA
"1830","FL","Suned High of South Broward","399262",NA
"1831","FL","Sunrise High School","105055",NA
"1832","FL","Sunshine High School Greater Orlando Campus","399264",NA
"1833","FL","The Einstein School","70451",NA
"1834","FL","The One Room School House Project","70459",NA
"1835","FL","Polk Avenue Elementary School","70017",NA
"1836","FL","Slam Middle School - Palm Beach","399230",NA
"1837","FL","The Seaside School","70468",NA
"1838","IN","Perry Schools Township","399322",NA
"1839","IN","Greater Jasper Consolidated Schools","64841",NA
"1840","IN","Lawrenceburg Community School Corporation","109877",NA
"1841","IN","Northwest Allen County Schools","64836",NA
"1842","IL","Brownstown Community Unit School District 201","399310",NA
"1843","IL","East St. Louis Area Joint Agreement","33122",NA
"1844","IL","Gallatin County Community Unit School District #7","196567",NA
"1845","IN","North Adams Community Schools","64834",NA
"1846","IN","Irvington Community School","188136",NA
"1847","IN","Tell City-Troy Township School Corporation","65306",NA
"1848","CO","Aspen School District No. 1 (RE)","57279",NA
"1849","IN","Metropolitan School District of Washington Township","399361",NA
"1850","KS","Southeast Kansas Special Education Interlocal 637","49456",NA
"1851","IN","Greencastle Community School Corporation","65295",NA
"1852","IN","Linton-Stockton School Corporation","109904",NA
"1853","IN","West Lafayette Community School Corporation","107891",NA
"1854","KS","Holton Unified School Distrcit No. 336","93924",NA
"1855","ID","St. Maries Joint School District 41","399354",NA
"1856","CA","Alpine County Office of Education","67002",NA
"1857","CA","Alview-Dairyland Union Elementary School District","145887",NA
"1858","CA","Big Sur Unified School District","145941",NA
"1859","CA","Ballico-Cressey Elementary School District","93605",NA
"1860","CA","Buckeye Union Elementary School District","145967",NA
"1861","CA","Buena Vista Elementary School District","145970",NA
"1862","CA","Central Union Elementary School District","146008",NA
"1863","CA","Clay Joint Elementary School District","146027",NA
"1864","CA","Flournoy Union Elementary School District","146136",NA
"1865","CA","Rim of the World Unified School District","146555",NA
"1866","CA","Greenfield Union Elementary School District Kern County","399389",NA
"1867","CA","Island Union Elementary School District","146232",NA
"1868","CA","Jefferson Elementary School District (San Benito County)","67409",NA
"1869","CA","Jefferson Elementary School District (San Joaquin County)","67410",NA
"1870","CA","Julian Union High School District","146242",NA
"1871","CA","Junction Elementary School District (Shasta County)","146244",NA
"1872","CO","Colorado River Board of Cooperative Educational Services","59201",NA
"1873","CA","La Honda Pescadero Unified School District","67448",NA
"1874","CA","Linns Valley Poso Flat Union Elementary","67493",NA
"1875","CA","Lakeside Joint Elementary School District","146284",NA
"1876","OK","Colcord Public Schools","84865",NA
"1877","CA","Lakeside Union School District (Kern County)","93671",NA
"1878","CA","Magnolia Union Elementary School District","146345",NA
"1879","OK","Deborah Brown Community School District No G001","398892",NA
"1880","CA","Pacific Elementary School District","146473",NA
"1881","CA","Montecito Union Elementary School District","399396",NA
"1882","CA","Mountain View Elementary School District Los Angeles County","399398",NA
"1883","CA","Pioneer Union Elementary School District (Butte County)","67707",NA
"1884","CA","New Castle Elementary","67628",NA
"1885","CA","Pioneer Union Elementary School District (El Dorado County)","67708",NA
"1886","CA","North Cow Creek Elementary School District","67634",NA
"1887","CA","Pleasant Valley Elementary School District","146516",NA
"1888","CA","Oak Grove Union Elementary School District","146446",NA
"1889","CA","Ocean View Elementary School District Orange County","399401",NA
"1890","CA","Raymond Knowles Union Elementary","67748",NA
"1891","ID","Grace Joint School District No. 148","224638",NA
"1892","ID","Wilder School District No. 133","224663",NA
"1893","IL","Black Hawk Area Special Education District 865","224066",NA
"1894","CA","Sequoia Union Elementary School District","146642",NA
"1895","CA","Sierra County Office of Education","67874",NA
"1896","CA","Sierra-Plumas Joint Unified School District","146651",NA
"1897","CA","Round Valley Joint Elementary School District","146578",NA
"1898","CA","San Benito County Office of Education","98941",NA
"1899","CA","San Mateo County Office of Education","42663",NA
"1900","CA","Spreckels Union School District","1140030",NA
"1901","IL","Pembroke Community Consolidated School District #259","93885",NA
"1902","CA","Stanislaus County Office of Education","31725",NA
"1903","CA","Santa Clara Elementary School District","146620",NA
"1904","CA","Santa Rosa City School District","31511",NA
"1905","IL","Thornton Fractional Township High School District 215","224224",NA
"1906","AZ","Toltec School District No. 22","66976",NA
"1907","IL","Mt. Olive Community Unit School District No.5","224161",NA
"1908","KS","Oskaloosa Unified School District No. 341","224292",NA
"1909","KS","Nemaha Central Unified School District 115","224288",NA
"1910","AZ","Lukachukai Community School","46159",NA
"1911","CA","Washington Union Elementary School District","146761",NA
"1912","KS","Ellsworth Unified School District No. 327","224327",NA
"1913","MI","Dr. Joseph F. Pollack Academic Center of Excellence","161686",NA
"1914","MI","Houghton-Portage Township School District","224802",NA
"1915","MI","Ingham Intermediate School District","161586",NA
"1916","CA","Westwood Unified School District","146778",NA
"1917","MI","Macomb Intermediate School District","1091484",NA
"1918","MI","West Shore Educational Service District","55945",NA
"1919","CO","Strasburg School District 31j","223949",NA
"1920","MO","Billings R-4 School District","53993",NA
"1921","MO","Hamilton R-II School District","224858",NA
"1922","MO","Mountain Grove R-III School District","35352",NA
"1923","KS","Southeast Kansas Education Service Center","40507",NA
"1924","IN","Metropolitan School District Decatur Township","399496",NA
"1925","MO","Maysville R-I School District","224866",NA
"1926","IN","Madison-Grant United School Corporation","109898",NA
"1927","IN","South Putnam Community Schools","107815",NA
"1928","IN","School City of East Chicago","74669",NA
"1929","IN","South Putnam Community School Corporation","66441",NA
"1930","IN","South Ripley Community School Corporation","107816",NA
"1931","IN","Silver Creek School Corporation","399500",NA
"1932","IN","West Clark Community Schools","65311",NA
"1933","IN","Salem Community Schools","64865",NA
"1934","IN","Northwestern School Corporation","93917",NA
"1935","MO","Reorganized School District No. 1","167914",NA
"1936","IN","Maconaquah School Corporation","64856",NA
"1937","IN","South Central Community School Corporation","107813",NA
"1938","IN","Rush County School Corporation","107803",NA
"1939","ND","Northern Cass Public School District 97","224976",NA
"1940","NE","Crofton Community Schools, District No. 96","108934",NA
"1941","ME","Five Town Community School District","399540",NA
"1942","ME","Great Salt Bay Community School District","399541",NA
"1943","ME","Maine School Administrative District No. 28","399543",NA
"1944","NJ","Elmwood Park Board of Education","35711",NA
"1945","ME","Town of Bristol School Department","399547",NA
"1946","IL","Regional Office of Education 17","399583",NA
"1947","IL","Unity Point School District 140","399585",NA
"1948","IN","Rush County Schools","105675",NA
"1949","OK","Idabel School District No. 1-005","147193",NA
"1950","OR","South Lane School District No. 45j3","197353",NA
"1951","OR","Multnomah Education Service District","164432",NA
"1952","OK","Okemah School District Number 1-26","37448",NA
"1953","MA","Ralph C Mahar Regional School District","48573",NA
"1954","MA","Shawsheen Valley Regional Vocational_technical School District","34212",NA
"1955","PA","Southern Fulton School District","228870",NA
"1956","PA","Tuscarora Intermediate Unit 11","38081",NA
"1957","MT","Three Forks School District No. J-24","399714",NA
"1958","MT","Chester-Joplin-Inverness School District No. 48-1j & 48-2j","399705",NA
"1959","MT","Conrad Public Schools","399706",NA
"1960","MT","Fairfield School District 21","399707",NA
"1961","MT","Heart Butte School District 1","35416",NA
"1962","MT","Lolo School District No. 7","399710",NA
"1963","MT","Missoula Area Education Cooperative","43123",NA
"1964","MT","Superior Public Schools","399713",NA
"1965","TX","Davis Independent School District No. 1-10","163593",NA
"1966","MA","Mount Greylock Regional School District","399826",NA
"1967","NH","Rivendell Interstate School District","399845",NA
"1968","NH","School Administrative Unit No. 44","64964",NA
"1969","KS","Tonganoxie Unified School District No 464","399824",NA
"1970","OH","Arcadia Local School District","82468",NA
"1971","MT","Potomac School District 11","399775",NA
"1972","AR","Barton School District","1027228",NA
"1973","TX","Region 18 Education Service Center","41696",NA
"1974","NM","Isleta Elementary School","57938",NA
"1975","NY","Island Park Union Free School District","90152",NA
"1976","NY","Board of Cooperative Educational Services of Rockland County","36365",NA
"1977","NY","Board of Cooperative Educational Services of Nassau County","45052",NA
"1978","AR","South Central Service Cooperative","101689",NA
"1979","IL","Mokena Public Schools District 159","93875",NA
"1980","AR","Cross County School District No.7","98665",NA
"1981","OH","Collins Career Center","57390",NA
"1982","OH","Mid-Ohio Educational Service Center","65312",NA
"1983","OH","Montgomery County Educational Service Center","37196",NA
"1984","OH","Mechanicsburg Exempted Village School District","83707",NA
"1985","OH","Miami East Local School District","83748",NA
"1986","OH","Ottawa Hills Local School District","84042",NA
"1987","OH","Scioto County Career Technical Center","37249",NA
"1988","OH","Frontier Local School District","83146",NA
"1989","OH","Educational Service Center of Central Ohio","91095",NA
"1990","OH","Educational Service Center of Northeast Ohio","37068",NA
"1991","OH","Twin Valley Community Local School District","84604",NA
"1992","OK","Agra Public Schools I-134","400127",NA
"1993","OK","Buffalo Valley Public School District I-3","400142",NA
"1994","OK","Banner Public School District No. 31","146863",NA
"1995","OK","Depew Public Schools","147049",NA
"1996","OK","Allen-Bowden Public Schools","400130",NA
"1997","OK","Deer Creek Public Schools-ISD No.6","190781",NA
"1998","OK","Harrah Public School District ISD 7","190810",NA
"1999","OK","Howe Public Schools","400172",NA
"2000","OK","North Rock Creek School District C-10","200042",NA
"2001","OK","Putnam City School District I-1","198307",NA
"2002","CO","Buena Vista School District R-31","400207",NA
"2003","MS","Marion County School District","35049",NA
"2004","OK","Shady Grove School District C-26","400274",NA
"2005","OK","Sequoyah County Educational Facilities Authority","400272",NA
"2006","OK","Wayne Independent School District No. 10","147727",NA
"2007","OK","Turkey Ford Public Schools","147679",NA
"2008","CA","Yreka Union High School District","146804",NA
"2009","OR","Clatskanie School District No. 6j","90798",NA
"2010","OR","Jefferson School District No. 14j","94019",NA
"2011","OR","Lebanon Community School District No. 9","86149",NA
"2012","CO","Wiggins School District Re-50j","400401",NA
"2013","MA","King Philip Regional School District","400408",NA
"2014","CA","Sonora School District","146662",NA
"2015","IN","Michigan City Area Schools","65243",NA
"2016","IL","District 50 Schools","400404",NA
"2017","GA","Baker County Board of Education","189183",NA
"2018","IL","Bureau, Henry, and Stark Counties Regional Office of Education No. 28","47467",NA
"2019","IN","Metropolitan School District of Southwest Allen County","170639",NA
"2020","AZ","East Valley Institute of Technology School District No. 401","44602",NA
"2021","IL","Champaign and Ford Counties Regional Office of Education No. 9","400485",NA
"2022","AZ","Antelope Union High School District No. 50","400460",NA
"2023","IL","Pleasant Valley School Dist. No. 62","400464",NA
"2024","IL","Regional Office of Education 21","400465",NA
"2025","MA","Lower Pioneer Valley Educational Collaborative","171166",NA
"2026","MA","Manchester-Essex Regional School District","400495",NA
"2027","ME","Maine School Administrative District No. 8","400496",NA
"2028","MT","Roundup Public School Districts No. 55 and 55h","400503",NA
"2029","FL","Andrews High School","68492",NA
"2030","FL","Berkley Elementary School District","68616",NA
"2031","FL","Gulf Coast Elementary School","399107",NA
"2032","NH","Milton New Hampshire School District","54395",NA
"2033","FL","Palm Pointe Educational Research School at Tradition","69899",NA
"2034","CA","Wasco Union Elementary School District","146756",NA
"2035","NJ","Hudson County Schools of Technology","35621",NA
"2036","NJ","Roselle Park School District","398629",NA
"2037","NJ","Cedar Grove Public Schools","398598",NA
"2038","NJ","Waterford Township Board of Education","398640",NA
"2039","NJ","East Greenwich Board of Education","398603",NA
"2040","OH","Auglaize County Educational Service Center","52127",NA
"2041","OH","Muskingum Valley Educational Service Center","43879",NA
"2042","OH","Columbus Grove Local School District","82854",NA
"2043","MT","Great Divide Education Services","43164",NA
"2044","MT","Arlee Public Schools","35408",NA
"2045","OR","Malheur Educational Service District","164430",NA
"2046","OH","Ross-Pike Educational Service District","46519",NA
"2047","NY","Holland Central School District","99121",NA
"2048","PA","Berks County Intermediate Unit","400715",NA
"2049","PA","School District of the City of Jeannette","87497",NA
"2050","PA","North Clarion County School District","400752",NA
"2051","PA","Fannett-Metal School District","228665",NA
"2052","PA","Midland Borough School District","400748",NA
"2053","IN","Washington Community Schools Inc","74689",NA
"2054","SD","Dakota Valley School District No. 61-8","400823",NA
"2055","RI","Foster-Glocester Regional School District","400790",NA
"2056","MO","Lonedell R-14 School District","167899",NA
"2057","SD","Dell Rapids School District No. 49-3","400824",NA
"2058","SD","Garretson School District 49-4","400825",NA
"2059","SD","Sioux Valley School District No. 5-5","400831",NA
"2060","SD","Britton-Hecla School District No. 45-4","400822",NA
"2061","FL","San Jose Primary School","399220",NA
"2062","MS","Forrest County Agricultural High School","398567",NA
"2063","TN","Bells City School Board of Education","106570",NA
"2064","OR","West Linn-Wilsonville School District No. 3jt","42417",NA
"2065","SD","Redfield School District 56-4","400830",NA
"2066","WA","Cusick School District No 59","99188",NA
"2067","VT","Orange Southwest School District","59303",NA
"2068","VT","Southwest Vermont Supervisory Union","46360",NA
"2069","WA","Dieringer School District","401093",NA
"2070","VT","Derby School District","401076",NA
"2071","VT","Windham Northeast Supervisory Union","39387",NA
"2072","VT","Windsor Central Unified Union School District","401078",NA
"2073","WA","Cle Elum-Roslyn School District No 404","88964",NA
"2074","WA","Entiat School District No 127","103207",NA
"2075","WA","Pateros School District No 122-70j","89224",NA
"2076","WA","Rainier School District No 307","89274",NA
"2077","WA","North Central Educational Service District No. 171","48842",NA
"2078","WA","Willapa Valley School District No 160","103211",NA
"2079","WA","Olympic Educational Service District No. 114","39652",NA
"2080","WA","Naselle-Grays River Valley School District No 155","89180",NA
"2081","WA","White Pass School District No 303","89429",NA
"2082","WA","Raymond School District No. 116","89276",NA
"2083","WI","Kickapoo Area School District","401162",NA
"2084","WI","School District of Belleville","401177",NA
"2085","TN","Tennessee School for the Blind - Internal School Fund","107403",NA
"2086","PA","Chartiers-Houston School District","401898",NA
"2087","CA","Alexander Valley Union Elementary School District","145876",NA
"2088","ND","Upper Valley Special Education District","36828",NA
"2089","PA","South Side Area School District","401899",NA
"2090","ID","Wallace School District No. 393","419824",NA
"2091","WI","School District of New Glarus","401914",NA
"2092","IL","Henderson-Knox-Mercer-Warren Regional Office of Education 33","483849",NA
"2093","KS","Southern Lyon County USD No. 252","583286",NA
"2094","KS","Lansing Unified School District No. 469","93938",NA
"2095","AZ","Joseph City Unified School District No. 2","548114",NA
"2096","IL","School District U-46","33019",NA
"2097","PA","Beaver Valley Intermediate Unit","37872",NA
"2098","PA","Pittsburgh-Mount Oliver Intermediate Unit 2","37852",NA
"2099","OH","Mahoning County Educational Service Center","42308",NA
"2100","PA","Leechburg Area School District","553147",NA
"2101","IN","Zionsville Community Schools","64837",NA
"2102","IA","Iowa Education Benefits Program","163018",NA
"2103","ID","Kellogg Joint School District 391","793712",NA
"2104","WI","Hartland-Lakeside Joint School District No. 3","822832",NA
"2105","PA","The School District of the City of Harrisburg","87524",NA
